Product Url,Product Title,Price,Rating,Number of Review,ASIN,Product Description
https://www.amazon.com/House-Quirk-Electronics-Accessories-Organizer/dp/B07MMGBD1J/ref=sr_1_97?crid=2M096C61O4MLT&keywords=bags&qid=1675431632&sprefix=ba%2Caps%2C283&sr=8-97,House of Quirk Electronics Accessories Organizer Bag Universal Carry Travel Gadget Bag for Cables Plug and More Perfect Size Fits for Pad Phone Charger Hard Disk - Dark Blue,499,4.3 out of 5 stars,"6,468",B07MMGBD1J,NA
https://www.amazon.com/F-Gear-Enzo-Red-Sports-Waist-Bag/dp/B0862LF7HS/ref=sr_1_98?crid=2M096C61O4MLT&keywords=bags&qid=1675431632&sprefix=ba%2Caps%2C283&sr=8-98,F Gear Enzo Sports Waist Bag (.Red),197,4.2 out of 5 stars,751,B0862LF7HS,NA
https://www.amazon.com/Genie-Clara-Backpack-Women-compartments/dp/B097JJGR1N/ref=sr_1_99?crid=2M096C61O4MLT&keywords=bags&qid=1675431632&sprefix=ba%2Caps%2C283&sr=8-99,Genie Clara Backpack for Women - 3 compartments Laptop Bags for Girls Stylish and Trendy College Backpacks for Girls Water Resistant and Lightweight Bags for Office and Travelling Purpose.,1025,4.2 out of 5 stars,29,B097JJGR1N,NA
https://www.amazon.com/Tabelito-Laptop-Backpack-15-6-inch-Repellent/dp/B08Y5S6C2P/ref=sr_1_100?crid=2M096C61O4MLT&keywords=bags&qid=1675431632&sprefix=ba%2Caps%2C283&sr=8-100,Tabelito® Casual Laptop Bag 15.6inch (39.6 cm)  25 LTR Office College School Bags Business Travel Backpack for Men Women Water Resistant Bags(BLACK),549,4.2 out of 5 stars,"1,499",B08Y5S6C2P,NA
https://www.amazon.com/Genie-Spritz-Daypack-Fashion-Backpack/dp/B083ZDT8SD/ref=sr_1_101?crid=2M096C61O4MLT&keywords=bags&qid=1675431632&sprefix=ba%2Caps%2C283&sr=8-101,Genie Spritz Daypack 14 inch Stylish and Trendy College backpacks for girls Water Resistant and Lightweight Mini Bags for Travelling Purpose. Latest Collection of Backpack for women (Rose),349,4.2 out of 5 stars,"2,289",B083ZDT8SD,NA
https://www.amazon.com/Red-Lemon-Polyester-15-6-inch-Waterproof/dp/B07XYY2FW4/ref=sr_1_102?crid=2M096C61O4MLT&keywords=bags&qid=1675431632&sprefix=ba%2Caps%2C283&sr=8-102,Red Lemon Polyester Bange Series 15.6inch Laptop Bag for Men 35 LTR Capacity Daily Office Bag for Men and Women Black (1903),2849,4.2 out of 5 stars,152,B07XYY2FW4,NA
https://www.amazon.com/Amazon-Brand-Backpack-15-6-inch-Laptops/dp/B076QFBFRG/ref=sr_1_103?crid=2M096C61O4MLT&keywords=bags&qid=1675431632&sprefix=ba%2Caps%2C283&sr=8-103,Amazon Brand - Solimo Laptop Backpack for 15.6-inch Laptops (27 litres Black),449,3.8 out of 5 stars,"1,215",B076QFBFRG,NA
https://www.amazon.com/COSMUS-Multipurpose-Backpack-Bag-compartment/dp/B078JVT384/ref=sr_1_104?crid=2M096C61O4MLT&keywords=bags&qid=1675431632&sprefix=ba%2Caps%2C283&sr=8-104,COSMUS Madison waterproof Multipurpose Backpack With laptop compartment  33L,1196,4.2 out of 5 stars,"2,166",B078JVT384,NA
https://www.amazon.com/Lino-Perros-Womens-Sling-Black/dp/B07B4FBQ3X/ref=sr_1_105?crid=2M096C61O4MLT&keywords=bags&qid=1675431632&sprefix=ba%2Caps%2C283&sr=8-105,Lino Perros Sling bag,789,4.2 out of 5 stars,596,B07B4FBQ3X,NA
https://www.amazon.com/Business-Casual-Resistant-Laptop-Backpack/dp/B0862V2GKH/ref=sr_1_106?crid=2M096C61O4MLT&keywords=bags&qid=1675431632&sprefix=ba%2Caps%2C283&sr=8-106,Mi Business Casual 21L Water Resistant Laptop Backpack (Blue),999,4.4 out of 5 stars,"6,051",B0862V2GKH,NA
https://www.amazon.com/Baggit-Womens-Satchel-Handbag-Grey/dp/B098TKJG1L/ref=sr_1_107?crid=2M096C61O4MLT&keywords=bags&qid=1675431632&sprefix=ba%2Caps%2C283&sr=8-107,Baggit Women's Sling Bag (Grey),837,4.3 out of 5 stars,780,B098TKJG1L,NA
https://www.amazon.com/Protecta-Professional-15-6-inch-Briefcase-Geometric/dp/B07GNCRCP4/ref=sr_1_108?crid=2M096C61O4MLT&keywords=bags&qid=1675431632&sprefix=ba%2Caps%2C283&sr=8-108,Protecta The Professional Laptop Bag Briefcase for Laptops with Screen Size Up to 15.6 Inch (Black & Indian Geometric Print),699,4.4 out of 5 stars,"1,382",B07GNCRCP4,NA
https://www.amazon.com/Safari-Overnighter-Resistant-Travelling-All-Purpose/dp/B097JMR4M6/ref=sr_1_109?crid=2M096C61O4MLT&keywords=bags&qid=1675431632&sprefix=ba%2Caps%2C283&sr=8-109,Safari Seek 32 Ltrs Overnighter Travel Laptop Backpack (Black) Water Resistant Spacious Bag for Travelling and Camping All-Purpose Bag for Business & Leisure,1789,4.1 out of 5 stars,68,B097JMR4M6,NA
https://www.amazon.com/AUXTER-BLACKY-Duffel-Emboss-Black/dp/B07F2H25NP/ref=sr_1_110?crid=2M096C61O4MLT&keywords=bags&qid=1675431632&sprefix=ba%2Caps%2C283&sr=8-110,Auxter Faux Leather 23 Cms Duffle Bag(Aux_Gb_Le_Black -Se__0521_Black),376,4.3 out of 5 stars,"8,804",B07F2H25NP,NA
https://www.amazon.com/Step-Backpack-Small-Water-Repellant/dp/B088XG77KN/ref=sr_1_111?crid=2M096C61O4MLT&keywords=bags&qid=1675431632&sprefix=ba%2Caps%2C283&sr=8-111,Mi Step Out 12 L Mini Backpack (Small Size Red Water Repellant),249,4.1 out of 5 stars,"7,634",B088XG77KN,NA
https://www.amazon.com/Gear-Ltrs-Casual-Backpack-MDBKPECO50504/dp/B0757K36YV/ref=sr_1_112?crid=2M096C61O4MLT&keywords=bags&qid=1675431632&sprefix=ba%2Caps%2C283&sr=8-112,Gear Moderneco5 21L Water Resistant School Bag/Backpack/College Bag For Men/Women - Navyblue,429,3.9 out of 5 stars,"2,497",B0757K36YV,NA
https://www.amazon.com/Gear-Ltrs-Casual-Backpack-MDBKPECO50504/dp/B0757K36YV/ref=sr_1_113?crid=2M096C61O4MLT&keywords=bags&qid=1675431645&sprefix=ba%2Caps%2C283&sr=8-113,Gear Moderneco5 21L Water Resistant School Bag/Backpack/College Bag For Men/Women - Navyblue,429,3.9 out of 5 stars,"2,497",B0757K36YV,NA
https://www.amazon.com/F-Gear-Luxur-Brown-Backpack/dp/B01F7AX9ZA/ref=sr_1_114?crid=2M096C61O4MLT&keywords=bags&qid=1675431645&sprefix=ba%2Caps%2C283&sr=8-114,F Gear Luxur Brown 25 liter Laptop Backpack (2404),1099,4.4 out of 5 stars,"16,291",B01F7AX9ZA,NA
https://www.amazon.com/Business-Casual-Resistant-Laptop-Backpack/dp/B0862V2GKH/ref=sr_1_115?crid=2M096C61O4MLT&keywords=bags&qid=1675431645&sprefix=ba%2Caps%2C283&sr=8-115,Mi Business Casual 21L Water Resistant Laptop Backpack (Blue),999,4.4 out of 5 stars,"6,051",B0862V2GKH,NA
https://www.amazon.com/SFANE-Duffel-Shoulder-Women-Compartment/dp/B07ZC77WTW/ref=sr_1_116?crid=2M096C61O4MLT&keywords=bags&qid=1675431645&sprefix=ba%2Caps%2C283&sr=8-116,SFANE Polyester Blue Duffle/Gym Bag/Shoulder Bag for Men & Women with Separate Shoes Compartment (Blue),428,4.3 out of 5 stars,"3,058",B07ZC77WTW,NA
https://www.amazon.com/Protecta-Professional-15-6-inch-Briefcase-Geometric/dp/B07GNCRCP4/ref=sr_1_117?crid=2M096C61O4MLT&keywords=bags&qid=1675431645&sprefix=ba%2Caps%2C283&sr=8-117,Protecta The Professional Laptop Bag Briefcase for Laptops with Screen Size Up to 15.6 Inch (Black & Indian Geometric Print),699,4.4 out of 5 stars,"1,382",B07GNCRCP4,NA
https://www.amazon.com/Nivia-5177SB-Polyester-String-Blue/dp/B071XMLFTL/ref=sr_1_118?crid=2M096C61O4MLT&keywords=bags&qid=1675431645&sprefix=ba%2Caps%2C283&sr=8-118,NIVIA String Bag/Drawstring Bag/Sports Bag Boys/Polyester String Bag/Kit Bags/Drawstring Sports Bag/Dori Backpack/Gym Bag/String Bag Men Waterproof/Drawstring Backpack (Sky Blue),193,4.2 out of 5 stars,444,B071XMLFTL,NA
https://www.amazon.com/Leatherette-Executive-messenger-multiple-compartments/dp/B099NM8621/ref=sr_1_119?crid=2M096C61O4MLT&keywords=bags&qid=1675431645&sprefix=ba%2Caps%2C283&sr=8-119,"Zipline Synthetic Leather Executive SMALL messenger bag Briefcase for upto 13"" Laptop/Tablet for men women with multiple compartments (1-Tan Bag)",938,3.9 out of 5 stars,337,B099NM8621,NA
https://www.amazon.com/Lify-Womens-Shoulder-Crossbody-Handbag/dp/B09JWMW646/ref=sr_1_120?crid=2M096C61O4MLT&keywords=bags&qid=1675431645&sprefix=ba%2Caps%2C283&sr=8-120,Lify Women's Retro Large Size Canvas Shoulder Bag Hobo Crossbody Handbag Casual Tote - 1 Piece,320,3.8 out of 5 stars,"1,226",B09JWMW646,NA
https://www.amazon.com/Lavie-Malgana-Womens-Tote-Black/dp/B07PKHC72N/ref=sr_1_121?crid=2M096C61O4MLT&keywords=bags&qid=1675431645&sprefix=ba%2Caps%2C283&sr=8-121,Lavie Women's Malnov Tote Bag | Ladies Purse Handbag,₹1013.94,4.1 out of 5 stars,"4,829",B07PKHC72N,NA
https://www.amazon.com/YuvKuz-TM-Infocus-Digitizer-Assembly/dp/B07MXNWTB2/ref=sr_1_122?crid=2M096C61O4MLT&keywords=bags&qid=1675431645&sprefix=ba%2Caps%2C283&sr=8-122,Lavie Women's Nova Tote Bag | Ladies Purse Handbag,824,4.2 out of 5 stars,"7,320",B07MXNWTB2,NA
https://www.amazon.com/LL-LEATHER-LAND-DESIGNER-BAGS/dp/B0BD4TTDHD/ref=sr_1_123?crid=2M096C61O4MLT&keywords=bags&qid=1675431645&sprefix=ba%2Caps%2C283&sr=8-123,LL LEATHER LAND DESIGNER BAGS Sling Bag_SLG_90,299,4.0 out of 5 stars,"1,548",B0BD4TTDHD,NA
https://www.amazon.com/VIP-Endura-Puller-Brown-Duffle/dp/B0B527KJQZ/ref=sr_1_124?crid=2M096C61O4MLT&keywords=bags&qid=1675431645&sprefix=ba%2Caps%2C283&sr=8-124,VIP Polypropylene 48 Cms Travel Bag(DFENDEBRN_Brown),899,4.4 out of 5 stars,335,B0B527KJQZ,NA
https://www.amazon.com/Step-Backpack-Small-Water-Repellant/dp/B088XG77KN/ref=sr_1_125?crid=2M096C61O4MLT&keywords=bags&qid=1675431645&sprefix=ba%2Caps%2C283&sr=8-125,Mi Step Out 12 L Mini Backpack (Small Size Red Water Repellant),249,4.1 out of 5 stars,"7,634",B088XG77KN,NA
https://www.amazon.com/DZert-Panda-School-Backpacks-Cartoon/dp/B07Y2BFJ1B/ref=sr_1_126?crid=2M096C61O4MLT&keywords=bags&qid=1675431645&sprefix=ba%2Caps%2C283&sr=8-126,DZert Kids School Bag Soft Plush Backpacks Cartoon Boys Girls Baby (2-5 Years),239,3.7 out of 5 stars,"10,957",B07Y2BFJ1B,NA
https://www.amazon.com/Storite-Leather-Sling-Bag-Brown/dp/B08TR8RMNH/ref=sr_1_127?crid=2M096C61O4MLT&keywords=bags&qid=1675431645&sprefix=ba%2Caps%2C283&sr=8-127,Storite Stylish Small PU Leather Sling Cross Body Travel Office Messenger One Side Shoulder Bag for Men Women(Brown 20.5x9x16.5cm),799,4.1 out of 5 stars,810,B08TR8RMNH,NA
https://www.amazon.com/ASTRID-Black-Textured-Laptop-Accessory/dp/B09Z2G37YY/ref=sr_1_128?crid=2M096C61O4MLT&keywords=bags&qid=1675431645&sprefix=ba%2Caps%2C283&sr=8-128,ASTRID Women's 17'' Black and White Textured Laptop Bag With Accessory Pouch,999,3.9 out of 5 stars,56,B09Z2G37YY,NA
https://www.amazon.com/Gear-Superior-Casual-Backpack-BKPSPRIOR0001/dp/B08GY2ZN96/ref=sr_1_145?crid=2M096C61O4MLT&keywords=bags&qid=1675431658&sprefix=ba%2Caps%2C283&sr=8-145,Gear Superior 16LWater Resistant School Bag//Backpack/College Bag for Men/Women - Black,395,3.9 out of 5 stars,(216),B08GY2ZN96,NA
https://www.amazon.com/AirCase-C25-Messenger-Shoulder-Compartments/dp/B07X6DV3VM/ref=sr_1_146?crid=2M096C61O4MLT&keywords=bags&qid=1675431658&sprefix=ba%2Caps%2C283&sr=8-146,"AirCase Office Messenger Sling Bag fits upto 15.6"" Laptop/Macbook Detachable Shoulder Strap Waterproof Shockproof Carry Handle with Spacious Pockets For Men & Women",949,4.0 out of 5 stars,(572),B07X6DV3VM,NA
https://www.amazon.com/ADISA-SL5022-black-women-girls/dp/B07NPXWFXX/ref=sr_1_147?crid=2M096C61O4MLT&keywords=bags&qid=1675431658&sprefix=ba%2Caps%2C283&sr=8-147,ADISA Women's & Girls' Sling Bag,495,4.1 out of 5 stars,"(2,772)",B07NPXWFXX,NA
https://www.amazon.com/DZert-School-Polyester-Backpack-White/dp/B07GXYHFCY/ref=sr_1_148?crid=2M096C61O4MLT&keywords=bags&qid=1675431658&sprefix=ba%2Caps%2C283&sr=8-148,DZert Clasy Laptop Bag College Bag for Boys Girls 21 L Blue White,299,3.8 out of 5 stars,"(2,236)",B07GXYHFCY,NA
https://www.amazon.com/ADISA-SL5038-women-girls-sling/dp/B08Q4FHQLN/ref=sr_1_149?crid=2M096C61O4MLT&keywords=bags&qid=1675431658&sprefix=ba%2Caps%2C283&sr=8-149,ADISA Women's Sling Bag,575,4.0 out of 5 stars,"(2,561)",B08Q4FHQLN,NA
https://www.amazon.com/Gear-Vintage2-Leather-Backpack-LBPVG2LTH0201/dp/B07G4D13L7/ref=sr_1_150?crid=2M096C61O4MLT&keywords=bags&qid=1675431658&sprefix=ba%2Caps%2C283&sr=8-150,Gear Vintage2 28L Faux Leather Water Resistant Anti Theft Laptop Bag/Backpack for Men/Women-Brown,949,4.4 out of 5 stars,"(3,587)",B07G4D13L7,NA
https://www.amazon.com/Bennett-15-6-inch-Repellent-Backpack-ben_cas_blue/dp/B09WZKB54G/ref=sr_1_151?crid=2M096C61O4MLT&keywords=bags&qid=1675431658&sprefix=ba%2Caps%2C283&sr=8-151,Bennett Laptop Bag for Menं & Women 15.6 inch 35 L Water Resistant Bag Laptop Apple / Dell / Lenovo / Asus / Hp / Samsung / Mi / MacBook / Ultrabook / Thinkpad / Ideapad / Surfacepro (Blue),512,4.0 out of 5 stars,(348),B09WZKB54G,NA
https://www.amazon.com/Number-Backpack-Compartment-Charging-Organizer/dp/B09VTDMRY7/ref=sr_1_152?crid=2M096C61O4MLT&keywords=bags&qid=1675431658&sprefix=ba%2Caps%2C283&sr=8-152,FUR JADEN Anti Theft Number Lock Backpack Bag with 15.6 Inch Laptop Compartment USB Charging Port & Organizer Pocket for Men Women Boys Girls,689,3.9 out of 5 stars,"(2,697)",B09VTDMRY7,NA
https://www.amazon.com/Safari-Formal-Backpack-Anti-Theft-VAULT19CBBLK/dp/B07XSTR69N/ref=sr_1_153?crid=2M096C61O4MLT&keywords=bags&qid=1675431658&sprefix=ba%2Caps%2C283&sr=8-153,Safari 48 Cms Black Formal/Office/Laptop Backpack With Anti-Theft Lock Usb And Rfid (Vault19Cbblk),1399,4.0 out of 5 stars,(783),B07XSTR69N,NA
https://www.amazon.com/Chic-Buddy-Waterproof-Swimsuits-Toiletries/dp/B09KS97LZH/ref=sr_1_154?crid=2M096C61O4MLT&keywords=bags&qid=1675431658&sprefix=ba%2Caps%2C283&sr=8-154,Chic Buddy Waterproof Wet Bag Washable Reusable for Travel Beach Pool Stroller Diapers Dirty Gym Clothes Wet Swimsuits Toiletries,299,4.5 out of 5 stars,(257),B09KS97LZH,NA
https://www.amazon.com/Lenovo-Professional-Backpack-Water-resistant-Uncompromised/dp/B08R7S55H4/ref=sr_1_155?crid=2M096C61O4MLT&keywords=bags&qid=1675431658&sprefix=ba%2Caps%2C283&sr=8-155,"Lenovo 15.6"" Professional Backpack Made in India Water-resistantUncompromised storage Travel friendly:Fleece-lined PC compartmentVentedPadded BackPanel & Adjustable shoulder strapsLuggage strap",1337,4.2 out of 5 stars,(696),B08R7S55H4,NA
https://www.amazon.com/American-Tourister-Polypropylene-LG4-08/dp/B0BB2LX7LW/ref=sr_1_156?crid=2M096C61O4MLT&keywords=bags&qid=1675431658&sprefix=ba%2Caps%2C283&sr=8-156,American Tourister Polypropylene Hard 68 cms Luggage- Suitcase(LG4 (0) 08 002_Iron Grey),2899,4.0 out of 5 stars,(152),B0BB2LX7LW,NA
https://www.amazon.com/Artistix-Backpack-Anti-Theft-Charging-Resistance/dp/B082PKX18C/ref=sr_1_157?crid=2M096C61O4MLT&keywords=bags&qid=1675431658&sprefix=ba%2Caps%2C283&sr=8-157,Artistix 25 ltrs (30 cms)backpack(Talon_40cm_black),999,4.3 out of 5 stars,"(2,764)",B082PKX18C,NA
https://www.amazon.com/Chic-Buddy-Waterproof-Swimsuits-Toiletries/dp/B0B25B5PB6/ref=sr_1_158?crid=2M096C61O4MLT&keywords=bags&qid=1675431658&sprefix=ba%2Caps%2C283&sr=8-158,Chic Buddy Waterproof Wet Bag Washable Reusable for Travel Beach Pool Stroller Diapers Dirty Gym Clothes Wet Swimsuits Toiletries,289,4.5 out of 5 stars,(257),B0B25B5PB6,NA
https://www.amazon.com/Gear-Polyester-Travel-Duffle-DUFCRSTNG0406/dp/B075MMWRW6/ref=sr_1_159?crid=2M096C61O4MLT&keywords=bags&qid=1675431658&sprefix=ba%2Caps%2C283&sr=8-159,Gear Polyester 74 Cms Duffle Bag(Dufcrstng0406_Grey),539,4.1 out of 5 stars,"(15,924)",B075MMWRW6,NA
https://www.amazon.com/Lino-Perros-Womens-Tote-Pink/dp/B07JN9G66H/ref=sr_1_160?crid=2M096C61O4MLT&keywords=bags&qid=1675431658&sprefix=ba%2Caps%2C283&sr=8-160,Lino Perros leatherette Tote Bag,1168,4.3 out of 5 stars,"(2,534)",B07JN9G66H,NA
https://www.amazon.com/Gear-Classic-Leather-Backpack-LBPCLSLTH0101/dp/B07G4D13LB/ref=sr_1_177?crid=2M096C61O4MLT&keywords=bags&qid=1675431670&sprefix=ba%2Caps%2C283&sr=8-177,Gear Classic 20L Faux Leather Water Resistant Anti Theft Laptop Bag/Backpack for Men/Women-Black,999,4.4 out of 5 stars,"2,528",B07G4D13LB,NA
https://www.amazon.com/Safari-Casual-Backpack-Charging-Resistant/dp/B09B2581S9/ref=sr_1_178?crid=2M096C61O4MLT&keywords=bags&qid=1675431670&sprefix=ba%2Caps%2C283&sr=8-178,Safari Sneak Casual Backpack with USB Charging Port 26 Ltrs Water Resistant Fabric - Grey L (SNEAK19CBGRE),899,3.7 out of 5 stars,764,B09B2581S9,NA
https://www.amazon.com/Zipline-Synthetic-Executive-Briefcase-compartments/dp/B0BL3G2JKV/ref=sr_1_179?crid=2M096C61O4MLT&keywords=bags&qid=1675431670&sprefix=ba%2Caps%2C283&sr=8-179,ZIPLINE Office Laptop Synthetic Leather Executive Formal 15.6 inch Laptop & MacBook Briefcase Messenger/Office/Travel/Business Bag for Men Women with Multiple compartments,1599,4.3 out of 5 stars,14,B0BL3G2JKV,NA
https://www.amazon.com/Skybags-Unisex-Grey-Jacqard-Laptop/dp/B09ZV9SLBJ/ref=sr_1_180?crid=2M096C61O4MLT&keywords=bags&qid=1675431670&sprefix=ba%2Caps%2C283&sr=8-180,Skybags Unisex Grey Jacqard 34L Laptop Bags,1353,4.5 out of 5 stars,13,B09ZV9SLBJ,NA
https://www.amazon.com/Storage-Disposable-Freezer-Feeding-Transparent/dp/B099ZVTNCP/ref=sr_1_181?crid=2M096C61O4MLT&keywords=bags&qid=1675431670&sprefix=ba%2Caps%2C283&sr=8-181,LuvLap Baby Breast Milk Storage Bags (Pack of 50) BPA Free Disposable Milk Freezer Bags for Breast Feeding Transparent,549,4.3 out of 5 stars,516,B099ZVTNCP,NA
https://www.amazon.com/AirCase-Messenger-13-Inch-14-Inch-MacBook/dp/B07WS6HTHY/ref=sr_1_182?crid=2M096C61O4MLT&keywords=bags&qid=1675431670&sprefix=ba%2Caps%2C283&sr=8-182,AirCase C26 13.3 Inch/14 Inch Messenger Laptop Bag with Shoulder Strap Water resistant Handle and 2 Multi Utility Compartments (Black),949,4.1 out of 5 stars,"2,565",B07WS6HTHY,NA
https://www.amazon.com/Kuber-Industries-Transparent-Resistant-Handle-Set/dp/B08WK5QJ5D/ref=sr_1_183?crid=2M096C61O4MLT&keywords=bags&qid=1675431670&sprefix=ba%2Caps%2C283&sr=8-183,Kuber Industries Travel Toiletry Bag|Undergarments Organizer Bag|Makeup Bags|Transparent Shaving Bag for Men|Water Resistant with Zipper and Handle|Set of 2 (Cream),174,4.0 out of 5 stars,40,B08WK5QJ5D,NA
https://www.amazon.com/AirCase-Messenger-Detachable-Shoulder-Warranty/dp/B0BHZ12XQ7/ref=sr_1_184?crid=2M096C61O4MLT&keywords=bags&qid=1675431670&sprefix=ba%2Caps%2C283&sr=8-184,"AirCase Office Canvas Sling Messenger Bag fits Upto 15.6"" Laptop/ MacBook PU Leather Handles Detachable Shoulder Strap Easy to Clean for Office/ Travel Men & WomenGrey- 6 Month Warranty",999,NA,NA,B0BHZ12XQ7,NA
https://www.amazon.com/TULMAN-Stylish-Messenger-Shoulder-Bag/dp/B07Q74QLHT/ref=sr_1_185?crid=2M096C61O4MLT&keywords=bags&qid=1675431670&sprefix=ba%2Caps%2C283&sr=8-185,TULMAN Canvas Travel Sling Bag Cross Body One side Shoulder College Bag for Men & Women - 30 x 13 x 26 CM - Olive Green,799,4.1 out of 5 stars,366,B07Q74QLHT,NA
https://www.amazon.com/Storite-Stylish-Sling-Bag-Grey/dp/B098L372Z7/ref=sr_1_186?crid=2M096C61O4MLT&keywords=bags&qid=1675431670&sprefix=ba%2Caps%2C283&sr=8-186,Storite Stylish Padded Small Nylon Sling Cross Body Travel Office Bag for Men Women (22.5cm x 9.5cm x 22.5 cm Dark Grey),649,4.0 out of 5 stars,"1,043",B098L372Z7,NA
https://www.amazon.com/Capacity-Cosmetic-Portable-Cosmetics-Organizer/dp/B0BR123Z9J/ref=sr_1_187?crid=2M096C61O4MLT&keywords=bags&qid=1675431670&sprefix=ba%2Caps%2C283&sr=8-187,ZANIC'S Large Capacity Cosmetic Travel Bag Women's Makeup Travel Bag Portable Leather Cosmetics Bag Makeup Storage Bags with Handle and Divider Wide Opening Cosmetic/Makeup Organizer Bags (Pink),787,4.4 out of 5 stars,26,B0BR123Z9J,NA
https://www.amazon.com/Hammonds-Flycatcher-Messenger-Compartment-LB106BR/dp/B07P2TQH78/ref=sr_1_188?crid=2M096C61O4MLT&keywords=bags&qid=1675431670&sprefix=ba%2Caps%2C283&sr=8-188,Hammonds Flycatcher Genuine Leather Executive Formal Office Bag | Shoulder Laptop Messenger Bag for Men | MacBook|Notebook Upto 16 Inch| Crossbody Handbags with Shoulder Straps | Brown | LB106BR,2705,4.3 out of 5 stars,"4,565",B07P2TQH78,NA
https://www.amazon.com/wooum-Resistant-Material-Messenger-Compartment/dp/B0BQFHN15L/ref=sr_1_189?crid=2M096C61O4MLT&keywords=bags&qid=1675431670&sprefix=ba%2Caps%2C283&sr=8-189,wooum Water Resistant Material Sling Bag/One Side Bag/Shoulder Bag/Messenger Bag/Office Messenger Bag/Travel Side Bag with 14.1 Inch Laptop Compartment -,474,4.0 out of 5 stars,201,B0BQFHN15L,NA
https://www.amazon.com/VIFITKIT-Multi-Purpose-Spacious-Storage-Compartment/dp/B0B4BLYKYB/ref=sr_1_190?crid=2M096C61O4MLT&keywords=bags&qid=1675431670&sprefix=ba%2Caps%2C283&sr=8-190,VIFITKIT Gym Bag for Men & Women Duffel Bag Multi-Purpose Bag with Spacious Storage Compartment & Durable Zipper Closure (22.5 litres Blue & Black),299,4.1 out of 5 stars,34,B0B4BLYKYB,NA
https://www.amazon.com/Kleider-Nylon-Travel-Mobile-Messenger/dp/B08V5B5G14/ref=sr_1_191?crid=2M096C61O4MLT&keywords=bags&qid=1675431670&sprefix=ba%2Caps%2C283&sr=8-191,DEIN KLEIDER Nylon Cross Body Travel Mobile Pouch Sling Messenger Bag for Women,259,4.2 out of 5 stars,"1,331",B08V5B5G14,NA
https://www.amazon.com/Amazon-Brand-Womens-Sling-Light/dp/B07YXBTD6Z/ref=sr_1_192?crid=2M096C61O4MLT&keywords=bags&qid=1675431670&sprefix=ba%2Caps%2C283&sr=8-192,Amazon Brand - Eden & Ivy Women's Sling Bag,₹562.17,4.3 out of 5 stars,609,B07YXBTD6Z,NA
https://www.amazon.com/WILDHORN-Backpack-Compartment-Business-Stitching/dp/B09QL66G55/ref=sr_1_17?crid=2M096C61O4MLT&keywords=bags&qid=1675431682&sprefix=ba%2Caps%2C283&sr=8-17,"WILDHORN 31L Laptop Backpack for Men / Women I Fits upto 15.6"" Laptop I Waterproof I Travel / Business / College Bookbags",599,4.1 out of 5 stars,706,B09QL66G55,NA
https://www.amazon.com/Fur-Jaden-Black-Waterproof-Backpack/dp/B078GLXMDY/ref=sr_1_18?crid=2M096C61O4MLT&keywords=bags&qid=1675431682&sprefix=ba%2Caps%2C283&sr=8-18,Fur Jaden Anti Theft Backpack 15.6 Inch Laptop Bag with USB Charging Port,799,4.0 out of 5 stars,"10,540",B078GLXMDY,NA
https://www.amazon.com/Half-Moon-Spacious-Backpack-Compartment/dp/B0BLVQ9NTD/ref=sr_1_19?crid=2M096C61O4MLT&keywords=bags&qid=1675431682&sprefix=ba%2Caps%2C283&sr=8-19,Half Moon Strike 35L Unisex Spacious School/ Laptop/ College/ Office Travel Backpack Bag for Men Women Boys & Girls with 15.6 inch Padded Laptop Compartment & Multiple Pockets,699,3.6 out of 5 stars,45,B0BLVQ9NTD,NA
https://www.amazon.com/Half-Moon-Backpack-Compartment-Reflective/dp/B0BJ32LQ6X/ref=sr_1_20?crid=2M096C61O4MLT&keywords=bags&qid=1675431682&sprefix=ba%2Caps%2C283&sr=8-20,Half Moon Large 37L Laptop Bag Backpack for menं Women Boys and Girls Luggage Travel Bags with 17.3 inches Laptop Compartment & Rain Cover,849,3.9 out of 5 stars,"2,129",B0BJ32LQ6X,NA
https://www.amazon.com/Backpack-Small-Black-Water-Repellant/dp/B088XB5XY8/ref=sr_1_21?crid=2M096C61O4MLT&keywords=bags&qid=1675431682&sprefix=ba%2Caps%2C283&sr=8-21,Mi Step Out 12 L Mini Backpack (Small Size Black Water Repellant),349,4.1 out of 5 stars,"7,634",B088XB5XY8,NA
https://www.amazon.com/Lavie-Sport-Duffle-Luggage-Trolley/dp/B097RJ22Q3/ref=sr_1_22?crid=2M096C61O4MLT&keywords=bags&qid=1675431682&sprefix=ba%2Caps%2C283&sr=8-22,Lavie Sport Lino Large Size 63 cms Wheel Duffle Bag for Travel | Travel Bag with Trolley,999,4.0 out of 5 stars,"5,802",B097RJ22Q3,NA
https://www.amazon.com/Half-Moon-Waterproof-Laptop-Backpack/dp/B09QM9N1B3/ref=sr_1_23?crid=2M096C61O4MLT&keywords=bags&qid=1675431682&sprefix=ba%2Caps%2C283&sr=8-23,Half Moon 30L Waterproof 15.6 inch Laptop Office School College Bag Backpack for Men Women Boys & Girls,589,3.6 out of 5 stars,343,B09QM9N1B3,"['* Make sure this fits by entering your model number.', '* SPACIOUS AND LIGHTWEIGHT: Light weight and spacious laptop backpack with 3 compartments. One compartment is for carrying laptop inside (Upto 17 inches) with padding for safety and space for laptop accessories like charger etc. Second large compartment for books files and all your day to day essentials. And third compartment is for your extra stuff. It has provision for holding bottles on both sides and has padded shoulder straps for your comfort', '* COMFORT WITH QUALITY: This casual bag has Wide Padded and Adjustable shoulder straps and Padded Back for comfort in carrying heavy items. Stitched properly and Bartacks on every pressure point for extra durability. Made with strong yet light weight polyester fabric with heavy zippers. Serves the need of a professional office laptop bag college bag student backpack school bag and is suitable for all i.e. boys girls menं and womenं', '* PREMIUM FABRIC : Premium Polyester Stylish and durable backpack for school /college and travel. Easily accommodate a laptop. Size: 45 cm X 31 cm X 22 cm', '* INTERNAL ORGANISER: This backpack features an Internal Organiser that is small pockets inside the front compartment for holding pens ID cards etc. These pockets are very useful in organizing your small day-to-day items.', '* OTHER FEATURES: Strong and durable zippers Adjustable Shoulder Handles (Straps)  2 Bottle/Umbrella holders  Padded Handle  Padded Laptop Compartment  Ergonomic Design Reflector Logo etc']"
https://www.amazon.com/Gear-Classic-Leather-Backpack-LBPCLSLTH0201/dp/B07G4F6XFH/ref=sr_1_24?crid=2M096C61O4MLT&keywords=bags&qid=1675431682&sprefix=ba%2Caps%2C283&sr=8-24,Gear Classic 20L Faux Leather Water Resistant Anti Theft Laptop Bag/Backpack for Men/Women-Brown,1049,4.4 out of 5 stars,"5,330",B07G4F6XFH,NA
https://www.amazon.com/GEAR-Black-Blue-Backpack-years/dp/B019HA8AYG/ref=sr_1_25?crid=2M096C61O4MLT&keywords=bags&qid=1675431682&sprefix=ba%2Caps%2C283&sr=8-25,Gear CarryOn 16L Foldable Water Resistant School Bag//Backpack/College Bag for Men/Women - Blue Black,249,3.7 out of 5 stars,"5,923",B019HA8AYG,NA
https://www.amazon.com/Casual-Backpack-Charging-Laptop-Compartment/dp/B07J46KLFP/ref=sr_1_26?crid=2M096C61O4MLT&keywords=bags&qid=1675431682&sprefix=ba%2Caps%2C283&sr=8-26,Fur Jaden 15.6 Inch Laptop Backpack 25 LTR Bag for School College and Office with USB Charging Port,489,3.8 out of 5 stars,"9,822",B07J46KLFP,NA
https://www.amazon.com/Inovera-Label-Women-Handbags-Shoulder/dp/B08CMQD4BC/ref=sr_1_27?crid=2M096C61O4MLT&keywords=bags&qid=1675431682&sprefix=ba%2Caps%2C283&sr=8-27,INOVERA Faux Leather Women Handbags Shoulder Hobo Bag Purse With Long Strap 32L x 13B x 30H cm,1399,4.1 out of 5 stars,"6,808",B08CMQD4BC,NA
https://www.amazon.com/Step-Backpack-Small-Water-Repellant/dp/B088XH1BP7/ref=sr_1_28?crid=2M096C61O4MLT&keywords=bags&qid=1675431682&sprefix=ba%2Caps%2C283&sr=8-28,Mi Step Out 12 L Mini Backpack (Small Size Dark Blue Water Repellant),299,4.1 out of 5 stars,"7,634",B088XH1BP7,NA
